카테고리,질문,답
요금,기아멤버스 포인트로 충전요금을 결제하려면 어떻게 해야 하나요?,"SK 일렉링크 앱 로그인 후
① 기아멤버스 포인트를 연결할 멤버십카드 선택: 나→멤버십카드 관리→멤버십카드 옆 점 3개 모양 클릭→대표 멤버십카드 설정
② 선택한 대표 멤버십카드에 기아멤버스 포인트 결제등록: 나→마일리지&제휴포인트→우측 상단 점 3개 모양 클릭→기아멤버스 포인트 추가→기아멤버스 포인트 카드번호와 카드 비밀번호 입력"
요금,블루멤버스 포인트로 충전요금을 결제하려면 어떻게 해야 하나요?,"SK 일렉링크 앱 로그인 후
① 블루멤버스 포인트를 연결할 멤버십카드 선택: 나→멤버십카드 관리→멤버십카드 옆 점 3개 모양 클릭→대표 멤버십카드 설정
② 선택한 대표 멤버십카드에 블루멤버스 포인트 결제등록: 나→마일리지&제휴포인트→우측 상단 점 3개 모양 클릭→블루멤버스 포인트 추가→블루멤버스 포인트 카드번호와 카드 비밀번호 입력"
요금,"[럭키패스] 상시가입되나요? 매월 1일 정기결제라고 되어있는데, 월 중순에 가입할 수도 있나요?","네, 상시 가입되며 가입시점부터 당월말까지 사용기간을 고려하여 일할계산하여 구독료가 자동 결제됩니다."
요금,"[럭키패스] 매월 1일 정기결제라고 되어있는데, 구독시점에 따라 매월 구독료 결제 시기가 다른가요?",상시 가입이 되기 때문에 가입시점부터 해당월 말까지 사용기간을 일할계산하여 구독료가 자동결제됩니다. *ex. 6일 가입 시 5일을 제외하고 25일 치 럭키패스 멤버십 요금이 결제됨. 그리고 다음 달부터 매달 1일에 한 달분 구독료가 청구됩니다.
요금,"[럭키패스] 가입상품 이용량 초과시, 추가로 제공되는 혜택이 있는지, 정상충전요금의 3% 적립만 되는 건지 궁금해요.",가입상품 이용량 초과시 멤버십 일반충전료 정가로 이용하시게 됩니다. *포인트 적립: 할인받아 결제한 금액의 3%가 SK 일렉링크 크래딧으로 적립됨. SK 일렉링크 크래딧은 다음 달 정상결제 후 돌아오는 월요일에 일괄지급됩니다.
요금,"[럭키패스] 그린패스⟺라이트패스 간에 변경이 가능한가요? 변경할 수 있다면, 변경이 가능한 일자가 별도로 있나요?",요금제의 변경은 횟수 제한 없이 변경 가능합니다. 상품 변경은 익월부터 예약처리되기 때문에 당월은 기존 이용 상품으로 유지됩니다.
요금,[럭키패스] 충전기 이용에 지역 제한이 있나요?,"전국 SK 일렉링크 급속충전기 모두 사용가능합니다. 가입지역을 서울, 경기, 광주, 제주로 제한하는 것은 타지역에 급속충전기가 많지 않아 서비스이용에 불편을 드릴까봐입니다만, 자주 가는 SK 일렉링크 급속기가 있어서 럭키패스 구독을 원하시면, 고객 동의를 전제로 서비스를 구독하는 것이 가능합니다."
요금,[럭키패스] 럭키패스와 제휴 회원 대상 특별 할인이 중복으로 할인되나요?,"중복 적용되지 않습니다. 모든 청구는 럭키패스 정책이 가장 우선적으로 적용됩니다(예컨대, 기아회원 상시 10%할인과 중복적용되지 않습니다). *블루·레드멤버스 포인트로 충전요금 결제가 가능합니다."
요금,[럭키패스] EV전용 신용카드 등 카드사에서 제공하는 청구할인과 중복 할인 가능한가요?,"가능합니다. 카드사 충전료 할인은 고객님의 카드 사용실적에 따라 자사와 별개로 (카드사 자체)진행하는 이벤트입니다. *구독료는 충전료가 아닌, 멤버십 혜택 이용을 위한 정액 월회비이므로, 구독료는 신한EV카드 등 신용카드 청구할인 적용이 불가합니다."
요금,[럭키패스] 요금제 변경/취소는 어떻게 하면 되나요?,"로그인 상태에서 홈 화면 하단의 ‘스토어’ 버튼을 클릭합니다. ‘이번 달 …원의 할인혜택을 받고 계십니다’ 우측의 ‘화살표(→)’를 선택하고, ‘해지하기’ 혹은 ‘변경하기’ 버튼을 누릅니다."
충전기 사용,SK 일렉링크 회원가입 후 언제부터 충전기 이용이 가능한가요?,"SK 일렉링크 회원으로 가입하실 경우 자동으로 앱카드가 발행되며, 별도의 절차없이 바로 충전기 이용이 가능합니다."
충전기 사용,비회원도 충전기 이용이 가능한가요?,"네, 가능합니다. 회원으로 가입하지 않더라도 비회원 인증 방법을 통해 충전기 이용이 가능하며, 자세한 사항은 SK 일렉링크 홈페이지 “멤버십 소개” > “충전기 이용방법”을 참고해주세요."
충전기 사용,충전기 이용방법이 어떻게 되나요?,"충전기 이용방법은 회원, 비회원으로 나누어지며, 회원은 회원카드 인증, 회원번호 인증, 차량번호 인증 방법이 있고, 비회원은 비회원인증 방법이 있습니다. 자세한 사항은 SK 일렉링크 홈페이지 “멤버십 소개” > “충전기 이용방법”을 참고해주세요."
회원가입,법인회원은 어떻게 가입하나요?,"법인회원은 홈페이지를 통해 가입하셔야 합니다. 회원가입 시 회원 유형을 법인으로 선택하시고 회원가입을 진행하실 수 있습니다. 법인회원은 최대 5대까지 차량 등록이 가능하며, 법인 기본정보와 담당자 정보를 입력하시면 됩니다."
기타,"구매한 “SK 일렉링크 크래딧”도 있고, 무상으로 제공받은 “SK 일렉링크 크래딧”도 있어요. 마일리지랑 동시 사용이 가능한지 알려주세요.",구매한 “SK 일렉링크 크래딧”으로 결제하시는 충전 건에 대해서는 마일리지와 동시 사용 가능. 비구매 “SK 일렉링크 크래딧”⎯① 별도의 공급계약을 통해 지급된 경우 ② 당사가 무상 제공한 경우⎯으로 결제하시는 충전 건에 대해서는 마일리지와 동시 사용 불가.
기타,“SK 일렉링크 크래딧”과 “마일리지”는 동시 사용이 가능한가요?,"구매한 “SK 일렉링크 크래딧”은 마일리지와 동시 사용 가능 (예컨대, 10,000원 충전료 결제 시, 마일리지에서 10% 상당액인 1,000원 차감 후, 구매한 “SK 일렉링크 크래딧”으로 9,000원 결제 가능). 비구매 “SK 일렉링크 크래딧”⎯① 별도의 공급계약을 통해 지급된 경우 ② 당사가 무상 제공한 경우⎯은 마일리지와 동시 사용 불가."
기타,“SK 일렉링크 크래딧”과 “마일리지”는 어떻게 다른가요?,"“SK 일렉링크 크래딧”은 ① SK 일렉링크 및 제휴로밍충전소에서 현금처럼 사용가능(충전금액 전액 차감가능). ② 이용 가능처: 당사 및 로밍사. ③ 유효기간: 구매건 5년, 비구매건 1년. ⟺ “마일리지”는 ① 결제금액의 10% 한도로 사용가능(충전금액의 10% 차감가능). ② 이용 가능처: 당사. ③ 유효기간: 3년."
기타,“SK 일렉링크 크래딧”의 사용 유효 기간이 있나요?,"구매한 “SK 일렉링크 크래딧”의 사용 유효 기간은 5년입니다. 즉, 구매일로부터 5년이 경과하면 자동 소멸됩니다. 비구매 “SK 일렉링크 크래딧”⎯① SK 일렉링크 크래딧을 별도의 공급계약을 통해 지급된 경우 ② 당사가 고객 서비스 혹은 프로모션을 위해 무상 제공한 경우⎯의 사용 유효 기간은 1년입니다."
기타,SK 일렉링크 앱카드를 사용 중인데 실물카드를 발급받고 싶어요.,"SK 일렉링크 앱 로그인 후 “나” > “멤버십카드 관리” > 해당 앱카드 옆 점 3개 모양 클릭 > “실물카드 발급”을 눌러 발급받으실 수 있습니다. 앱카드를 사용하시다가 추후 실물카드를 발급받고자 하시면, 증정된 실물카드 미발급 크래딧 회수 차원에서 발급 비용(3,000원)을 부담하시게 됩니다."
기타,저희 업체 주차장에도 전기차 충전기가 있었으면 좋겠어요.,"SK 일렉링크 홈페이지 “파트너십” > “제휴 신청”을 통해 신청하실 수 있습니다. 공용충전기 신청 접수 이후 심사를 거쳐 적합하다고 판단될 경우, 신청업체와 협의 후 설치됩니다."
기타,멤버십 카드를 잃어버렸어요.,SK 일렉링크 앱 로그인 후 “나” > “멤버십카드 관리” > 잃어버린 카드 옆 점 3개 모양 클릭 > “분실/훼손 신고”를 눌러 분실 처리하실 수 있습니다.
